{
  "$schema": "https://json-schema.org/draft/2020-12/schema",
  "$id": "engineering-trace/engineering_model",
  "title": "Engineering Traceability Model",
  "type": "object",
  "required": ["name", "components", "dimensions", "connections", "rules"],
  "properties": {
    "name": { "type": "string" },
    "version": { "type": "string" },
    "components": {
      "type": "object",
      "additionalProperties": {
        "type": "object",
        "required": ["id", "name", "kind"],
        "properties": {
          "id": { "type": "string" },
          "name": { "type": "string" },
          "kind": {
            "type": "string",
            "description": "组件类别：tower_node/tower_bar/drawing_file/bom_row/gusset_plate/bolt_group/detail_view；证据层（P0 架构对齐 2026-09-05）：observation=图纸原始观测（bar_label 件号文字 / dim_sample DIMENSION 标注，稳定 ID obs_{stem}_{kind}_{handle}），hypothesis=结构解释候选（四态 proposed/accepted/rejected/superseded，稳定 ID hyp_{stem}_{generator}_{kind}_{zlo}_{zhi}）"
          },
          "source": { "$ref": "#/$defs/sourceRef" },
          "properties": {
            "type": "object",
            "properties": {
              "geometry_class": {
                "description": "阶段0 四类几何语义：recognized=直接识别 / reconstructed=确定性重建(含镜像) / derived=派生展示几何(corner_leg/diaphragm) / canonical=GT权威(仅评测)",
                "enum": ["recognized", "reconstructed", "derived", "canonical"]
              },
              "geometry_origin": {
                "description": "几何来源。仓库名：dxf_geom/hough_fallback/mllm_geom/mllm_inject/derived_4face；计划枚举名：hough/dxf_vector/multiview_solve/symmetry_rule/derived_diaphragm；gim=GT权威(仅评测/debug)",
                "enum": [
                  "mllm_geom", "hough", "hough_fallback", "dxf_vector", "dxf_geom",
                  "multiview_solve", "symmetry_rule", "derived_4face", "derived_diaphragm",
                  "mllm_inject", "gim",
                  "boundary_leg_bridge", "collinear_stitch", "crossarm_truss_completion",
                  "derived_parametric_base", "diag_complete", "diag_synth",
                  "diagonal_topology_reconstructed", "diaphragm_reconstructed",
                  "leg_chain_stitch", "leg_synth", "marker_synth", "multiview_hypothesis",
                  "panel_cross_reconstructed", "panel_subdivision", "panel_template_completion",
                  "side_diag_synth", "side_direct", "side_horiz_synth", "side_mirror",
                  "terminal_pair_gen", "x_crossing_uncouple"
                ]
              }
            }
          },
          "tags": { "type": "array", "items": { "type": "string" } }
        }
      }
    },
    "dimensions": {
      "type": "object",
      "additionalProperties": {
        "type": "object",
        "required": ["id", "name", "value", "unit", "origin"],
        "properties": {
          "id": { "type": "string" },
          "name": { "type": "string" },
          "value": {},
          "unit": { "type": "string" },
          "origin": { "enum": ["measured", "assumed", "derived", "placeholder"] },
          "source": { "$ref": "#/$defs/sourceRef" },
          "applies_to": { "type": "string" },
          "status": { "enum": ["pending", "passed", "failed", "not_applicable"] }
        }
      }
    },
    "connections": {
      "type": "object",
      "additionalProperties": {
        "type": "object",
        "required": ["id", "from_component", "to_component"],
        "properties": {
          "id": { "type": "string" },
          "from_component": { "type": "string" },
          "to_component": { "type": "string" },
          "connection_type": { "type": "string" },
          "source": { "$ref": "#/$defs/sourceRef" },
          "validation_status": { "enum": ["pending", "passed", "failed", "not_applicable"] },
          "rule_ids": { "type": "array", "items": { "type": "string" } },
          "validated_at": { "type": ["string", "null"] }
        }
      }
    },
    "rules": {
      "type": "object",
      "additionalProperties": {
        "type": "object",
        "required": ["id", "name", "description"],
        "properties": {
          "id": { "type": "string" },
          "name": { "type": "string" },
          "description": { "type": "string" },
          "applies_to": { "type": "array", "items": { "type": "string" } },
          "status": { "enum": ["pending", "passed", "failed", "not_applicable"] },
          "message": { "type": ["string", "null"] }
        }
      }
    },
    "dependencies": {
      "type": "object",
      "additionalProperties": {
        "type": "array",
        "items": { "type": "string" }
      }
    },
    "staleness": {
      "type": "object",
      "additionalProperties": { "enum": ["current", "stale"] }
    }
  },
  "$defs": {
    "sourceRef": {
      "type": "object",
      "required": ["source_type", "reference"],
      "properties": {
        "source_type": { "enum": ["drawing", "measurement", "assumption", "derived", "vendor", "unknown"] },
        "reference": { "type": "string" },
        "detail": { "type": ["string", "null"] },
        "confidence": { "type": "number", "minimum": 0, "maximum": 1 },
        "extracted_at": { "type": ["string", "null"] },
        "extracted_by": { "type": ["string", "null"] }
      }
    }
  }
}
